{
  "mission_id": "01KTESTMISSIONID0000000000",
  "mission_slug": "mission-001",
  "mission_number": 1,
  "mission_type": "software-dev",
  "target_branch": "main",
  "wp_count": 3,
  "friendly_name": "Mission 001",
  "purpose_tldr": "Give leadership a one-line view of the mission purpose.",
  "purpose_context": "This mission makes the practical purpose of the work visible to product and executive stakeholders so they can understand the intended outcome without reading technical details."
}
